{"aggregates":{"coverage":{"complete":true,"files_decoded":"at_or_above_threshold","files_quarantined":"below_threshold_nonzero","files_terminal":"at_or_above_threshold","files_total":"at_or_above_threshold","series_total":"at_or_above_threshold","studies_total":"at_or_above_threshold","test_series":"below_threshold_nonzero","test_studies":"below_threshold_nonzero","train_series":"at_or_above_threshold","train_studies":"at_or_above_threshold"},"duplicates":{"altered_metadata_groups":"range_20_39","candidate_edges":"range_8800_8819","cross_split_components":"zero","exact_file_groups":"zero","exact_pixel_groups":"range_1220_1239","exact_report_normalized_pairs":"range_980_999","exact_report_overlap_pairs":"range_940_959","exact_report_raw_pairs":"range_940_959","exact_report_union_pairs":"range_980_999","exact_series_groups":"range_20_39","exact_study_groups":"below_threshold_nonzero","future_fold_crossings":"zero","label_copy_candidates":"below_threshold_nonzero","near_report_candidate_pair_count_lower_bound":"zero","near_report_candidate_space_overflow":false,"near_report_edges":"zero","near_report_overflow_study_edges":"zero","near_series_candidate_pair_count_lower_bound":"range_1000000_1000019","near_series_candidate_space_overflow":true,"near_series_edges":"zero","near_series_overflow_study_edges":"range_4400_4419","near_slice_edges":"range_330340_330359","near_slice_edges_suppressed":"range_1712200_1712219","near_slice_groups":"range_63300_63319","near_slice_overflow_study_edges":"range_4340_4359","near_slice_study_pair_count_lower_bound":"range_250000_250019","near_slice_study_pair_space_overflow":true,"near_slice_unresolved_study_pairs":"zero","protected_components":"range_4400_4419","raw_container_variation_groups":"range_1180_1199"},"integrity":{"all_files_terminal":true,"all_series_terminal":true,"dicom_issue_dispositions_complete":true,"five_levels_reconciled":true,"foreign_keys":true,"private_artifacts_complete":true,"protected_graph_closed":true},"labels":{"conflict_cells":"zero","negative_cells":"range_440_459","non_official_sources":"zero","official_cells":"range_52880_52899","official_only":true,"positive_cells":"range_240_259","unknown_cells":"range_52180_52199"},"qa":{"selected_studies":"range_1880_1899"},"quality":{"files_decode_failure":"below_threshold_nonzero","files_unreadable":"zero","path_header_mismatch":"zero","patient_group_missing":"zero","series_fallback":"zero","series_geometry_pass":"at_or_above_threshold","series_quarantined":"below_threshold_nonzero","unexplained_dicom_issues":"zero"},"runtime":{"elapsed_seconds":10092},"scope":{"example_test_only":true,"hidden_test_evaluable":false,"mode":"full","source_context":"train-plus-example-test"},"shift":{"evaluation_scope":"train-plus-example-test","field_strength_t":"suppressed_low_test_support","in_plane_resolution_area_mm2":"suppressed_low_test_support","overall_missingness":"suppressed_low_test_support","patient_age_years":"suppressed_low_test_support","patient_sex":"suppressed_low_test_support","plane_availability":"suppressed_low_test_support","protocol_cluster":"suppressed_low_test_support","report_language":"not_evaluable_test_reports_unavailable","scanner_manufacturer":"suppressed_low_test_support","scanner_model":"suppressed_low_test_support","sequence_composition":"suppressed_low_test_support","series_description_vocabulary":"suppressed_low_test_support","site_domain_cluster":"suppressed_low_test_support","slice_thickness_mm":"suppressed_low_test_support","study_complexity_series_count":"suppressed_low_test_support","study_complexity_slice_count":"suppressed_low_test_support"},"versions":{"group_version":"protected-groups-v2","label_version":"official-labels-v1","manifest_version":"manifest-v2","preprocessing_version":"unassigned"}},"artifact_type":"manifest-audit-aggregate","disclosure":{"count_representation":"zero-below-threshold-at-or-above-threshold-or-fixed-width-range","cross_snapshot_protection":"fixed-width-intervals","interval_width":20,"minimum_export_cell":20,"percentages_published":false,"policy":"joint-complementary-k20-v1"},"privacy":{"minimum_export_cell":20,"patient_metadata":false,"pixel_data":false,"private_tables":false,"raw_identifiers":false,"raw_reports":false},"provenance":{"competition_config_sha256":"c41ce0dad5c24cd9a051facda3a4907c6f5bf5a0dc045df9eb9e380cbfe79006","competition_contract_sha256":"08e1c29635132dcfff78140e3a0f12723127cf8737954016c3adda192513813d","decoder_packages":{"pylibjpeg":"2.1.0","pylibjpeg-libjpeg":"2.4.0","pylibjpeg-openjpeg":"2.5.0"},"git_commit":"6fce3af8ba1cc85dacd6a29326f999bf5f5227ed","group_version":"protected-groups-v2","label_version":"official-labels-v1","manifest_schema_sha256":"4fa5806db32a767e2dcf7d6d7a97fb2caf1f3c07704c3a837a433642e05dee15","manifest_version":"manifest-v2","preprocessing_version":"unassigned","uv_lock_sha256":"d707ff22384bcbda10bc5ccd5780690794f5c5b3d1c92860a2a63eaa87caf759"},"schema_version":2,"status":"complete"}
